{
  "type": "activity_bank",
  "bank_id": "morphology_word_parts_master_bank",
  "activity_family": "morphology_word_parts",
  "title": "Morphology Word Parts Master Bank",
  "subject": "literacy_intervention",
  "grade_band": "6-8",
  "skill_focus": ["morphology", "prefixes", "suffixes", "roots", "word formation"],
  "index_axes": {
    "word_part_focus": ["prefixes", "suffixes", "roots", "mixed"],
    "difficulty_ladder": ["easiest", "easy", "core", "stretch"],
    "delivery_modes": ["movement", "whiteboard", "station"],
    "time_bands": ["5_min", "10_min", "15_min"],
    "support_bands": ["high_support", "medium_support", "low_support"]
  },
  "items": [
    {
      "item_id": "prefix_001",
      "prompt_type": "real_word_build",
      "stem": "___ + happy",
      "display_prompt": "Which prefix makes a real word with happy?",
      "response_options": ["un", "re", "mis", "pre"],
      "correct_responses": ["un"],
      "answer_pattern": "single_correct",
      "trap_flag": false,
      "difficulty_tier": "easiest",
      "support_level": "high_support",
      "whiteboard_compatible": true,
      "movement_compatible": true,
      "explanation": "unhappy is a real word.",
      "validation_status": "verified"
    },
    {
      "item_id": "prefix_002",
      "prompt_type": "trap_round",
      "stem": "___ + cover",
      "display_prompt": "Which prefixes make a real word with cover?",
      "response_options": ["dis", "re", "un", "mis"],
      "correct_responses": ["re", "un", "dis"],
      "answer_pattern": "multi_correct",
      "trap_flag": true,
      "trap_type": "multi_answer_trap",
      "difficulty_tier": "core",
      "support_level": "medium_support",
      "whiteboard_compatible": true,
      "movement_compatible": true,
      "explanation": "recover, uncover, and discover are real words; miscover is not standard.",
      "teacher_note": "Use this as a multiple-answer trap round.",
      "validation_status": "verified"
    },
    {
      "item_id": "suffix_001",
      "prompt_type": "real_word_build",
      "stem": "hope + ___",
      "display_prompt": "Which suffix makes a real word with hope?",
      "response_options": ["ful", "less", "ing", "er"],
      "correct_responses": ["ful", "less"],
      "answer_pattern": "multi_correct",
      "trap_flag": true,
      "trap_type": "multi_answer_trap",
      "difficulty_tier": "easy",
      "support_level": "medium_support",
      "whiteboard_compatible": true,
      "movement_compatible": true,
      "explanation": "hopeful and hopeless are both real words.",
      "validation_status": "verified"
    },
    {
      "item_id": "suffix_002",
      "prompt_type": "trap_round",
      "stem": "kind + ___",
      "display_prompt": "Which suffixes make a real word with kind?",
      "response_options": ["ness", "ly", "ing", "or"],
      "correct_responses": ["ness", "ly"],
      "answer_pattern": "multi_correct",
      "trap_flag": true,
      "trap_type": "multi_answer_trap",
      "difficulty_tier": "core",
      "support_level": "medium_support",
      "whiteboard_compatible": true,
      "movement_compatible": true,
      "explanation": "kindness and kindly are real words in this context.",
      "validation_status": "verified"
    },
    {
      "item_id": "root_001",
      "prompt_type": "root_meaning_match",
      "stem": "spect",
      "display_prompt": "Which root means to look?",
      "response_options": ["spect", "port", "tract", "geo"],
      "correct_responses": ["spect"],
      "answer_pattern": "single_correct",
      "trap_flag": false,
      "difficulty_tier": "easy",
      "support_level": "high_support",
      "whiteboard_compatible": true,
      "movement_compatible": true,
      "explanation": "spect relates to seeing or looking.",
      "validation_status": "verified"
    },
    {
      "item_id": "root_002",
      "prompt_type": "root_meaning_match",
      "stem": "Which root means write?",
      "display_prompt": "Which root means write?",
      "response_options": ["geo", "spect", "port", "tract"],
      "correct_responses": [],
      "answer_pattern": "none_correct",
      "trap_flag": true,
      "trap_type": "none_correct_trap",
      "difficulty_tier": "core",
      "support_level": "low_support",
      "whiteboard_compatible": true,
      "movement_compatible": true,
      "explanation": "None of the offered roots mean write.",
      "teacher_note": "Use when you want a none-correct corner or hold-up-whiteboard round.",
      "validation_status": "verified"
    },
    {
      "item_id": "mixed_001",
      "prompt_type": "mixed_word_part_build",
      "stem": "transportation",
      "display_prompt": "Which word part means carry in transportation?",
      "response_options": ["port", "trans", "tion", "pre"],
      "correct_responses": ["port"],
      "answer_pattern": "single_correct",
      "trap_flag": false,
      "difficulty_tier": "core",
      "support_level": "low_support",
      "whiteboard_compatible": true,
      "movement_compatible": true,
      "explanation": "port means carry.",
      "validation_status": "verified"
    }
  ]
}
